Sno,Title,Youtube Links
1,What is Flutter? & How it is Better than it's Counterparts? - Cross Platform | Full Tutorial,https://www.youtube.com/watch?v=jqxz7QvdWk8
2,What is Flutter Architecture? [HINDI] - Complete Tutorial,https://www.youtube.com/watch?v=PKDWinlLfAo
3,How to Install Flutter in Windows? - Flutter Installation Tutorial,https://www.youtube.com/watch?v=BqHOtlh3Dd4
4,Flutter Installation in MAC OS - Complete Tutorial.,https://www.youtube.com/watch?v=VPoqbBXzGtA
5,Android Studio Setup करे सिर्फ 15 Minutes में? | Install Android Studio on MacOS,https://www.youtube.com/watch?v=SR-AB3RJWbg
6,VS CODE INSTALLATION 👉 Download & Install Visual Studio Code on Mac OS,https://www.youtube.com/watch?v=p91tt2AwUjM
7,XCode Installation: How to Install XCode on MacOS - Complete Setup,https://www.youtube.com/watch?v=YOHFxBaPGQU
8,FLUTTER PROJECT ✅: How to Create a New Flutter Project | Flutter Beginners Tutorial,https://www.youtube.com/watch?v=B3MoTP3veBk
9,How to Create a New Flutter Project in VS CODE - Complete Guide,https://www.youtube.com/watch?v=_qkywk2VeHU
10,Generated Files and Folders - Complete Overview | Flutter Tutorial,https://www.youtube.com/watch?v=JzzBYI2LhLI
11,Create an Android Virtual Device for Flutter Application🔥,https://www.youtube.com/watch?v=tB1sjfijupU
12,Flutter Tutorial: How to Run an Android App on an Emulator - Complete Tutorial,https://www.youtube.com/watch?v=nsdW6s3FqUY
13,How to Run and Test Flutter App on a Real Android Device? | Flutter Tutorial,https://www.youtube.com/watch?v=fhDvSbcoM0Y
14,Flutter Tutorial: Running the App on an iOS Emulator | iOS Emulator Par App Kaise Chalaye?,https://www.youtube.com/watch?v=slopYVjSnMQ
15,Flutter Tutorial: Running the App on Web Browser | Web Browser पर App कैसे चलाये?,https://www.youtube.com/watch?v=xxz-v58i7g4
16,How to Run the App on macOS🔥 | Flutter Tutorial,https://www.youtube.com/watch?v=CWoIIr8KL_s
17,Step by Step Guide to Running Flutter App on Windows🔥,https://www.youtube.com/watch?v=vh6Rlka8sOM
18,Learn DART for Flutter | What is Dart Programming? | Dart Programming Language,https://www.youtube.com/watch?v=fnpD5NCzIIo
19,Dart Tutorial: How to Create the First Dart Program?,https://www.youtube.com/watch?v=jEylGBflNCs
20,Flutter Tutorial: Dart Class and Objects Kya Hai?,https://www.youtube.com/watch?v=iffK7bIFkG8
21,Dart Data Types and Variables - Complete Explanation | Flutter Tutorial,https://www.youtube.com/watch?v=ndchTCcp_Tc
22,Dart Var vs Dynamic - Difference | Flutter Dart Tutorial🔥,https://www.youtube.com/watch?v=jPYxYxdZf1M
23,What are Functions & Their Uses in Dart | Flutter Tutorial,https://www.youtube.com/watch?v=Afpq1r5G4sc
24,List in Dart Concept Tutorial for Beginners (Hindi) | Flutter🔥,https://www.youtube.com/watch?v=eqFGKEoY1zA
25,Flutter Dart: Maps and HashMaps in Dart Programming,https://www.youtube.com/watch?v=4e5tqRXGYQc
26,Final vs Const Keywords - Difference and How to Use? | Flutter Dart Tutorial,https://www.youtube.com/watch?v=gnfyM0xUNNA
27,What is Conditional Programming (Hindi)-Flutter Dart Programming,https://www.youtube.com/watch?v=K8jQrljrL3M
28,Dart Loops Kya Hai and How it Works? | Flutter Dart Tutorial,https://www.youtube.com/watch?v=nUGXH5p7-P0
29,Flutter Widgets: What is Container & How to Use it in Flutter?,https://www.youtube.com/watch?v=_R4Pr3tR0uY
30,Flutter Widgets: What is the Center Widget-Explained,https://www.youtube.com/watch?v=ATMuWZCu1kA
31,Flutter Widgets: Flutter Text and its Styles Widgets | Complete Guide [Hindi],https://www.youtube.com/watch?v=TEbSg0-L2ok
32,All Types of Button in Flutter - Complete Tutorial,https://www.youtube.com/watch?v=63IReaxPxhs
33,Flutter: How to Add Image in App - Complete Guide [Hindi],https://www.youtube.com/watch?v=GjuFaVk4mSs
34,What are Rows and Columns with Examples? | Flutter Widgets Tutorial,https://www.youtube.com/watch?v=YhOSXAAPcsA
35,What is InkWell Widget & Its Importance in Flutter [Hindi],https://www.youtube.com/watch?v=OwApCJUe-8o
36,Flutter ScrollView Widgets & Its Types-Complete Tutorial [Hindi],https://www.youtube.com/watch?v=T5M8qAJDHQU
37,What is ListView and its Components in Flutter | Flutter Widgets [Hindi],https://www.youtube.com/watch?v=z323YS-UDr4
38,"Flutter Installation: Windows,  Android Studio on VSCode & XCode - Complete Tutorial",https://www.youtube.com/watch?v=b_YcmSnx8eY
39,What is the Use of main.dart in Flutter & What does it contain? | Flutter Tutorials,https://www.youtube.com/watch?v=G16nLcpOLz0
40,How to Add Decoration to Container in Flutter - Explained [Hindi],https://www.youtube.com/watch?v=5hluA7fJzkk
41,What are Expanded Widgets in Flutter | Flutter Widgets Tutorial [Hindi],https://www.youtube.com/watch?v=etySPsyYKsc
42,How to Add Padding/Margin on Text Widget in Flutter - Complete Tutorial,https://www.youtube.com/watch?v=B61Cp1HcchI
43,What is Flutter ListTile and How its Included in ListView Builder,https://www.youtube.com/watch?v=xuyrIVEFNf0
44,Flutter Circle Avatar क्या है? | Flutter Widgets Tutorial,https://www.youtube.com/watch?v=8-hXkJRNq9s
45,How to Add Custom Font Over Text? | Flutter Widgets Tutorial [Hindi],https://www.youtube.com/watch?v=4Hm80CjOEWU
46,Flutter Styles and Themes - Explained | Flutter Widgets Tutorial,https://www.youtube.com/watch?v=e9YBnPNKEAY
47,Flutter Card Widget - Explained [Hindi],https://www.youtube.com/watch?v=2lO0EpHP5Zg
48,How to Get User Input in Flutter Application (TextField) | Flutter Widget,https://www.youtube.com/watch?v=BpN5f_747pI
49,How to Get Current Date & Time in Flutter Application?,https://www.youtube.com/watch?v=Q80ge-0mUGs
50,Flutter DateFormat: How to Format a Date? | Complete Tutorial [Hindi],https://www.youtube.com/watch?v=PtNOp4MQ32g
51,Flutter Date Picker Tutorial [Hindi] | Flutter Widgets🔥,https://www.youtube.com/watch?v=UIpTwzJ-TTU
52,Flutter GridView - How to Use Grid Layout? | Flutter Widget Tutorial,https://www.youtube.com/watch?v=UsFq21gYn5Q
53,What is Callback Function & How to Implement in Flutter Application🔥,https://www.youtube.com/watch?v=wa6ZtSRfI0w
54,Flutter Tutorial: Splitting the App into Widget | Complete Tutorial🔥,https://www.youtube.com/watch?v=Fdm9USwhiWk
55,Flutter Stack Widget | Complete Tutorial🔥😯,https://www.youtube.com/watch?v=jJGJCb0lVIc
56,Creating a Custom Widget in Flutter - Complete Tutorial,https://www.youtube.com/watch?v=HuD3Yx_QdCY
57,Concept of Wrap Widget in Flutter | Widget Tutorial🔥,https://www.youtube.com/watch?v=cIQ44oBlUA4
58,What are SizedBox Widgets in Flutter | Flutter Widgets Tutorial [Hindi],https://www.youtube.com/watch?v=-AHYS_fW-ow
59,Rich Text Widget Tutorial in Flutter [Hindi],https://www.youtube.com/watch?v=J248xKjnmck
60,Flutter Icon Widgets - Explained | Widget Tutorial,https://www.youtube.com/watch?v=W3BeEx2fiHw
61,Flutter Font Awesome Icons Tutorial [Hindi] 🔥,https://www.youtube.com/watch?v=GfFzcnG0sRs
62,Positioned Widget क्या है? | Flutter Widget Tutorial🔥,https://www.youtube.com/watch?v=oWGWeH3Rle8
63,Flutter Stateless and Stateful Widgets - Complete Tutorial [Hindi] 😮🔥,https://www.youtube.com/watch?v=h46lrbg8qUg
64,Updating Correctly with Stateful Widgets | Flutter Widget Tutorial🔥,https://www.youtube.com/watch?v=4TnI5JarxGs
65,Flutter Constraint Box Explained: How do I Use ConstraintBox in Flutter? - Complete Tutorial,https://www.youtube.com/watch?v=0LoqMKE5Kz8
66,Switching One Screen to Another Screen Flutter - Flutter Tutorial,https://www.youtube.com/watch?v=1YxHlJyjQWM
67,Create a Splash Screen in Flutter | Complete Tutorial🔥,https://www.youtube.com/watch?v=GCRmDHhTodE
68,Passing Data From One to Another Screen - Flutter Tutorial,https://www.youtube.com/watch?v=CqYF5-tuHvY
69,How to Add a Flutter Range Slider in 10 Minutes | Flutter Widgets Tutorial,https://www.youtube.com/watch?v=Wk0fau-CPas
70,How to Build BMI APP in Flutter | BMI Calculator Tutorial 🔥,https://www.youtube.com/watch?v=OwFMEhZbe_4
71,How to Animate Containers in Flutter? - App Animation Effect,https://www.youtube.com/watch?v=TAjgdAsHCaU
72,Flutter Animated Opacity Widget Tutorial🔥,https://www.youtube.com/watch?v=1xdC7a6Lmww
73,Flutter Animated Cross Fade Widget Tutorial (Widget of the Week),https://www.youtube.com/watch?v=mEUONqQIzC0
74,Hero Animation Widget Tutorial for Beginners | Flutter Animation 😮🔥,https://www.youtube.com/watch?v=ZbVoHGpVEPE
75,Flutter ListWheel ScrollView Widget Tutorial (Widget of the Week),https://www.youtube.com/watch?v=4_NDWUGDZRQ
76,Flutter ClipRRect Widgets Kya Hai? | Complete Tutorial,https://www.youtube.com/watch?v=v1PdkGW1CmA
77,What is Gradient & How to Add It to App Background? | Flutter Tutorial 🔥,https://www.youtube.com/watch?v=DukXpmkEHb4
78,Mapping Lists to Widget - Explained | Flutter Tutorial🔥,https://www.youtube.com/watch?v=GDB_zYFd0MA
79,Flutter Tween Animation - Explained | Animation Complete Tutorial 😮🔥,https://www.youtube.com/watch?v=esp-vyw040w
80,Flutter Ripple Animation Effects Tutorial For Beginners 🔥,https://www.youtube.com/watch?v=VISoK50eKvM
81,How to Store and Retrieve Data Using Shared Preference in Flutter Application? - Full Tutorial,https://www.youtube.com/watch?v=hiZcVbyukBo
82,Flutter Shared Preferences Login Tutorial 🔒,https://www.youtube.com/watch?v=jljwoxLOuSA
83,How to Create a Complete App on Your Mobile Without a Computer: Full Guide,https://www.youtube.com/watch?v=glr_5OOH6HQ
84,Flutter Database Course: How to Save Data Locally Using SQLite in Flutter [Practical Guide],https://www.youtube.com/watch?v=MWmtbZQKCGY
85,Flutter State Management Full Course in 2 Hours (All Topics Covered) - Updated 2025,https://www.youtube.com/watch?v=EFSFfEtznmU
86,Build TODO App Without Coding Using AI (Flutter + Gemini AI),https://www.youtube.com/watch?v=IuDgubGTDug
